{
  "schemaVersion": 1,
  "identities": {
    "npmScope": {
      "value": "@tinta-lang",
      "status": "verified"
    },
    "repository": {
      "value": "planta7/tinta",
      "status": "verified"
    },
    "marketplacePublisher": {
      "value": "planta7",
      "status": "verified"
    },
    "extensionName": {
      "value": "tinta",
      "status": "verified"
    }
  },
  "versions": {
    "implementation": "0.1.0",
    "npmChannel": "latest",
    "extension": "0.2.0",
    "extensionChannel": "stable",
    "contract": "1.0-draft.3",
    "sourceFormat": "1.0",
    "ir": "tinta-ir-1",
    "host": "tinta-host-1",
    "webview": "tinta-vscode-1"
  },
  "policy": {
    "sourceManifestsPrivate": true,
    "stagingRoot": "build/release-staging",
    "npmAccess": "public",
    "internalDependencies": "exact",
    "tagPrefix": "tinta-v",
    "releaseIdPattern": "tinta-{implementation}-vscode-{extension}-{extensionChannel}",
    "nodeRange": ">=24.21.0 <25",
    "vscodeRange": "^1.141.0",
    "parserDistribution": "bundle-patched-graph",
    "externalActivation": true
  },
  "packages": [
    {
      "id": "types",
      "source": "packages/types",
      "proposedName": "@tinta-lang/types",
      "identityStatus": "verified",
      "dependencies": [],
      "externalDependencies": {
        "@noble/hashes": "2.4.0",
        "fflate": "0.8.3"
      },
      "embeddedTargets": [],
      "environments": [
        "node-darwin-arm64",
        "node-linux-arm64",
        "node-win32-x64",
        "chromium-darwin-arm64",
        "firefox-darwin-arm64",
        "webkit-darwin-arm64"
      ]
    },
    {
      "id": "syntax",
      "source": "packages/syntax",
      "proposedName": "@tinta-lang/syntax",
      "identityStatus": "verified",
      "dependencies": ["types"],
      "externalDependencies": {
        "micromark": "4.0.3",
        "mdast-util-from-markdown": "2.1.0",
        "micromark-extension-gfm-table": "2.1.2",
        "micromark-extension-gfm-task-list-item": "2.1.0",
        "micromark-extension-gfm-strikethrough": "2.1.0",
        "mdast-util-gfm-table": "2.0.0",
        "mdast-util-gfm-task-list-item": "2.0.0",
        "mdast-util-gfm-strikethrough": "2.0.1",
        "@noble/hashes": "2.4.0"
      },
      "embeddedTargets": [],
      "environments": [
        "node-darwin-arm64",
        "node-linux-arm64",
        "node-win32-x64",
        "chromium-darwin-arm64",
        "firefox-darwin-arm64",
        "webkit-darwin-arm64"
      ]
    },
    {
      "id": "engine",
      "source": "packages/engine",
      "proposedName": "@tinta-lang/engine",
      "identityStatus": "verified",
      "dependencies": ["types", "syntax"],
      "externalDependencies": {
        "@noble/hashes": "2.4.0"
      },
      "embeddedTargets": [],
      "environments": [
        "node-darwin-arm64",
        "node-linux-arm64",
        "node-win32-x64",
        "chromium-darwin-arm64",
        "firefox-darwin-arm64",
        "webkit-darwin-arm64"
      ]
    },
    {
      "id": "charts",
      "source": "packages/charts",
      "proposedName": "@tinta-lang/charts",
      "identityStatus": "verified",
      "dependencies": ["types", "engine"],
      "externalDependencies": {
        "d3-array": "3.2.4",
        "d3-scale": "4.0.2",
        "d3-shape": "3.2.0"
      },
      "embeddedTargets": [],
      "environments": [
        "node-darwin-arm64",
        "node-linux-arm64",
        "node-win32-x64",
        "chromium-darwin-arm64",
        "firefox-darwin-arm64",
        "webkit-darwin-arm64"
      ]
    },
    {
      "id": "reader",
      "source": "packages/reader",
      "proposedName": "@tinta-lang/reader",
      "identityStatus": "verified",
      "dependencies": ["types", "engine", "charts"],
      "externalDependencies": {},
      "embeddedTargets": [],
      "environments": [
        "node-darwin-arm64",
        "node-linux-arm64",
        "node-win32-x64",
        "chromium-darwin-arm64",
        "firefox-darwin-arm64",
        "webkit-darwin-arm64"
      ]
    },
    {
      "id": "artifacts",
      "source": "packages/artifacts",
      "proposedName": "@tinta-lang/artifacts",
      "identityStatus": "verified",
      "dependencies": ["types", "syntax", "engine", "charts"],
      "externalDependencies": {
        "fflate": "0.8.3",
        "@noble/hashes": "2.4.0",
        "ajv": "8.20.0",
        "ajv-formats": "3.0.1"
      },
      "embeddedTargets": ["reader-runtime"],
      "environments": [
        "node-darwin-arm64",
        "node-linux-arm64",
        "node-win32-x64",
        "chromium-darwin-arm64",
        "firefox-darwin-arm64",
        "webkit-darwin-arm64"
      ]
    },
    {
      "id": "local-files",
      "source": "packages/local-files",
      "proposedName": "@tinta-lang/local-files",
      "identityStatus": "verified",
      "dependencies": ["types", "artifacts"],
      "externalDependencies": {},
      "embeddedTargets": [],
      "environments": [
        "node-darwin-arm64",
        "node-linux-arm64",
        "node-win32-x64"
      ]
    },
    {
      "id": "cli",
      "source": "packages/cli",
      "proposedName": "@tinta-lang/cli",
      "identityStatus": "verified",
      "dependencies": ["types", "engine", "artifacts", "local-files"],
      "externalDependencies": {},
      "embeddedTargets": ["studio-standalone"],
      "environments": [
        "node-darwin-arm64",
        "node-linux-arm64",
        "node-win32-x64"
      ]
    },
    {
      "id": "language-service",
      "source": "packages/language-service",
      "proposedName": "@tinta-lang/language-service",
      "identityStatus": "verified",
      "dependencies": ["types", "syntax", "engine"],
      "externalDependencies": {},
      "embeddedTargets": [],
      "environments": [
        "node-darwin-arm64",
        "node-linux-arm64",
        "node-win32-x64",
        "chromium-darwin-arm64",
        "firefox-darwin-arm64",
        "webkit-darwin-arm64"
      ]
    },
    {
      "id": "language-server",
      "source": "packages/language-server",
      "proposedName": "@tinta-lang/language-server",
      "identityStatus": "verified",
      "dependencies": ["types", "language-service"],
      "externalDependencies": {
        "vscode-languageserver": "10.1.2"
      },
      "embeddedTargets": [],
      "environments": [
        "node-darwin-arm64",
        "node-linux-arm64",
        "node-win32-x64"
      ]
    }
  ],
  "artifacts": [
    {
      "id": "vscode",
      "kind": "vsix",
      "source": "apps/vscode",
      "destination": "marketplace-and-download",
      "identityStatus": "verified",
      "dependencies": [
        "types",
        "local-files",
        "artifacts",
        "engine",
        "reader",
        "language-service",
        "language-server"
      ],
      "embeddedTargets": [],
      "environments": [
        "vscode-darwin-arm64",
        "vscode-linux-arm64",
        "vscode-win32-x64"
      ],
      "contents": [
        "extension manifest",
        "extension.mjs",
        "server.mjs",
        "analysis worker",
        "artifact worker",
        "preview",
        "language catalog",
        "grammar",
        "README",
        "LICENSE",
        "THIRD_PARTY_NOTICES.txt"
      ],
      "externalDependencies": {
        "vscode-languageclient": "10.1.2"
      }
    },
    {
      "id": "studio-directory",
      "kind": "zip",
      "source": "apps/studio",
      "destination": "release-download",
      "identityStatus": "verified",
      "dependencies": [
        "types",
        "syntax",
        "engine",
        "charts",
        "reader",
        "artifacts"
      ],
      "embeddedTargets": [],
      "environments": [
        "chromium-darwin-arm64",
        "firefox-darwin-arm64",
        "webkit-darwin-arm64"
      ],
      "contents": [
        "index.html",
        "relative application chunks",
        "embedded compiler and preview",
        "LICENSE",
        "THIRD_PARTY_NOTICES.txt"
      ],
      "externalDependencies": {
        "react": "19.3.0",
        "react-dom": "19.3.0",
        "@codemirror/state": "6.7.6",
        "@codemirror/view": "6.43.14",
        "@codemirror/language": "6.13.1",
        "@codemirror/commands": "6.11.1",
        "@codemirror/search": "6.7.2",
        "@codemirror/autocomplete": "6.20.3",
        "@codemirror/lint": "6.9.7",
        "@codemirror/lang-markdown": "6.5.2"
      }
    },
    {
      "id": "studio-standalone",
      "kind": "zip",
      "source": "apps/studio",
      "destination": "release-download",
      "identityStatus": "verified",
      "dependencies": [
        "types",
        "syntax",
        "engine",
        "charts",
        "reader",
        "artifacts"
      ],
      "embeddedTargets": [],
      "environments": [
        "chromium-darwin-arm64",
        "firefox-darwin-arm64",
        "webkit-darwin-arm64"
      ],
      "contents": ["tinta-studio.html", "LICENSE", "THIRD_PARTY_NOTICES.txt"],
      "externalDependencies": {
        "react": "19.3.0",
        "react-dom": "19.3.0",
        "@codemirror/state": "6.7.6",
        "@codemirror/view": "6.43.14",
        "@codemirror/language": "6.13.1",
        "@codemirror/commands": "6.11.1",
        "@codemirror/search": "6.7.2",
        "@codemirror/autocomplete": "6.20.3",
        "@codemirror/lint": "6.9.7",
        "@codemirror/lang-markdown": "6.5.2"
      }
    },
    {
      "id": "reader-runtime",
      "kind": "zip",
      "source": "packages/reader",
      "destination": "release-download",
      "identityStatus": "verified",
      "dependencies": ["types", "engine", "charts"],
      "embeddedTargets": [],
      "environments": [
        "chromium-darwin-arm64",
        "firefox-darwin-arm64",
        "webkit-darwin-arm64"
      ],
      "contents": [
        "reader.js",
        "reader.css",
        "LICENSE",
        "THIRD_PARTY_NOTICES.txt"
      ],
      "externalDependencies": {}
    },
    {
      "id": "source",
      "kind": "zip",